id	feature	auc	p_value	p_adjusted	cohens_d	n_pos	n_neg	ci_lower	ci_upper	status	description	round
20366	lfhf_21d_slope × sleep_qual_21d_mean	0.7602	0.006993	0.020979	1.0571	60	93	0.6851	0.8323	DISCARD	R2 Interaction: lfhf_21d_slope x sleep_qual_21d_mean | Examining the interaction between long-term sympathetic activity and sleep quality	49
20369	rmssd_3d_slope × lfhf_21d_slope	0.6859	0.090909	0.121212	0.6659	85	128	0.6152	0.7583	DISCARD	R2 Interaction: rmssd_3d_slope x lfhf_21d_slope | Investigating the interaction between short-term parasympathetic activity and long-term sympathetic activity to identify potential biomarkers for depression	50
20370	rmssd_3d_slope × sleep_qual_21d_mean	0.4576	0.011988	0.045954	0.7819	92	192	0.3819	0.537	DISCARD	R2 Interaction: rmssd_3d_slope x sleep_qual_21d_mean | Examining the relationship between short-term parasympathetic activity and long-term sleep quality to understand their combined impact on depressive symptoms	50
20372	composite_r2_20372	0.0	0.688312	0.688312	0.1281	306	599	0.0	0.0	DISCARD	R2 Composite (rmssd_7d_mean+hr_7d_mean): Evaluating a composite measure of the balance between short-term parasympathetic and sympathetic activity to identify potential biomarkers for depression	50
20373	lfhf_21d_slope × sleep_lat_3d_mean	0.7043	0.022977	0.045954	1.0382	85	128	0.6369	0.765	DISCARD	R2 Interaction: lfhf_21d_slope x sleep_lat_3d_mean | Investigating the interaction between long-term sympathetic activity and short-term sleep latency to understand their combined impact on depressive symptoms	50
